name,category,icon,downloads,updateDate,description
Mountain Moto : Racing Moto,Game,https://lh6.ggpht.com/cAozmdt05T29WCId4UYQM2fa0V1P2t2i7q5T7zRtOYHxbzxJ0P_P7ou1BpQDUKad5w=w300,"100,000 - 500,000","October 25, 2013","This is a mountain moto adventure game, the game easy to difficult, very exciting!Hrottle, speed, and coordination is the key to success in this Mountain Moto adventure game. Navigate your motorcross maven through a landscape riddled with challenges and obstacles.Play this free game today and explore an endless variety of mountains trails.Race through a variety of dangers and pitfalls, make crazy jumps and collect jewels and gold.You can commit your score and compare with other players all over the world!Tags:  motorsport dirtbike bike cycle racing action physics ragdoll rider crazy racing moto ATV mxmayhem mx mayhem motorcycle motorbike motorcross"
Krrish 3: The Game,Game,https://lh5.ggpht.com/_13UYGaefFtRfwPf2LUjNFvVNJUPBv-AKbeiuG8mKFogzOANUyc222dn2KiQ7zYANUM=w300,"500,000 - 1,000,000","November 2, 2013","KRRISH 3: THE OFFICIAL GAME FROM THE MOST ANTICIPATED BLOCKBUSTER OF 2013THANKS TO ALL FOR YOUR OVERWHELMING SUPPORT AND FOR YOUR FEEDBACK. BASED ON YOUR FEEDBACK, WE HAVE FIXED THE PROBLEMS IN VERSION 1.1 -# CONNECTIVITY ISSUES HAVE BEEN RESOLVED# MULTIPLAYER EXPERIENCE IS BEST ENJOYED ON 3G AND WIFI# TWEAKS AND BUG FIXES TO MAKE THE GAME-PLAY SMOOTHERPLEASE UPDATE TO VERSION 1.1 FOR A SUPERIOR MULTIPLAYER EXPERIENCE Get ready to relive the superhero life, perform breathtaking stunts and use state of the art gadgets & weapons to take down your enemies. Join KRRISH in his epic battle against EVIL as he faces off KAAL & FROGMAN to save humanity. This free, fast paced, multiplayer, action adventure game is truly one for the  superhero fans. Immerse yourself in the stunning graphics as you Climb, jump and slide across the Mumbai Skyline with players around the globe in multiplayer action. THE OFFICIAL GAME OF 2013’s MOST AWAITED SUPER HERO BLOCKBUSTER IS OUT NOW! * Choose among multiple characters like Krrish, Kaya and others to race with players around the world!* Use gadgets like Shuriken, Freeze Mine and many others to stall and entrap your opponents!* Level-up to unlock and flaunt new titles and gadget slots!* Perform superhuman parkour moves to traverse through the city’s skyline! EXPLORE THE CITY OF MUMBAI – FROM A DIFFERENT ANGLE * Race through richly themed 3D worlds, each featuring a different aspect of the city!* Explore the city through its 3 distinct sections - New City, Old City and The Industrial Zone."
Trucos PRO Candy Crush Saga,Game,https://lh3.ggpht.com/yTFP2ENSc7jlmR-ZP6xjdDQwG507D1tOTQaWSrnfoyiU8kUiOzXG1NxSzwdemtTg0W4=w300,"100,000 - 500,000","October 21, 2013",Ya están aqui los trucos PROFESIONALES de Candy Crus Saga para que te pases todos los nivelesTe propondremos una serie de TRUCOS Y CONSEJOS para que t pases el juego
Ultimate Movie Quiz,Game,https://lh4.ggpht.com/s7r3L9zYke6S1NQzaumPKXv7tx0sDB1P_nr7tvYhzUnStctgv9tGedd9nLAk5aUsOeU=w300,"5,000 - 10,000","November 5, 2013","Ultimate Movie Quiz — At its fanciful and most imaginable of its kind, a fun-filled guessing game which makes use of an exceptional, high quality movie posters  that aids you as you fathom each movie of the way. With the diverse genres of your most favorite movies this quiz app can offer, your skill in guessing the name of a movie by just looking at the snapshot is as much needed.  Dredge up as many movies as you can and unleash the inner movie enthusiast within you as you figure them all out. This quiz app features:— 600 movies to guess from a snapshot/poster—  Divided into 10 levels with 60 movies per level—  Each level tosses various movie posters across all genres from different periods of time. Test and find out how many movies you can actually name. Just tap in your answers.—  Got stuck? Grab your chance to use your free Hints. At the start of the game, you already have 100 hints which correspond to the points that can be deducted when you use the following hints:— — (1) Show letters used – shows only correct letters of the answer.— — (2) Show incomplete answer used – shows the answer with missing letters.— — (3) Show complete answer – answers the question for you.— — Your points will be deducted to 3, 2, and 7 points respectively when you used the aforementioned hints. — Still need help? Call a friend. Ask your Facebook and Twitter friends to guess the movie name for you to help you get back on track.  — Optimized for all resolutions— Download for freeSo now, ready to play the Ultimate Movie Quiz? Take the challenge and brace yourselves with the hundreds of movies coming your way. Tap DOWNLOAD and start playing. Way to go Film Fanatics!New movies are coming soon. Check for updates. We certainly hope you will have as much fun solving it as we did making it. Help us by sending feedback. Tags: Movies Quiz, Movie quiz Game, Guess The Movie, Film and Movie Quiz, Movie Posters Quiz, Film Quiz, Movie Trivia"
Snowstorm,Game,https://lh5.ggpht.com/48bLi18x4YirD0YER7LLE_ULEnRDbzlHz80_9Dgx-FlpgqJkSs1XPGnLnOY1XMg29E0=w300,"100,000 - 500,000","November 4, 2013","Welcome to the first 3D Freeride snowboarding simulator.SALE!!!. Reduce the cost of the package locations to 0.99 for the period up to December 1, 2013. Prepare to enter a liberating world on the mountain slopes. Ride anywhere you want down the slopes and perform incredible tricks and maneuvers on your own terms using a variety of boards built for speed or control. Earn money and spend it on new equipment and training.Game features: 1. Physics - You character moves according to their mass, the mountain’s slope and snow friction. 2. Immense Scale - Take any route you want down the largest possible slopes mobile devices can handle.3. Outstanding Visuals - Experience top-of-the-line visuals with graphical settings to satisfy high and low-end devices. A unique animation system shows dozens of animations working simultaneously to portray accurate rider movements.4. Intuitive Controls - Jumps, turns and tricks are made easy with simple controls via onscreen d-pad or simply tilting your device.5. Your Goals - Choose from existing goals like time trials, or set your own by collecting rewards and performing the most outrageous tricks on more than a dozen different snowboards. Compare your performances to players around the world on a global leaderboard.Pick your slope, loadout and good luck out in the mountains."
GTA V Cheats,Game,https://lh5.ggpht.com/6m7vh8zi5dmRMRQiZ20zkkQcRbDveGZMmab0E8wRPPyRxOkDFJZKXKgcH3i3__pioL0=w300,"100,000 - 500,000","November 2, 2013","GTA V Multiplayer-Cheats, download it and get the latest cheats to GTA V Multiplayer. Now you can get cheats for PS3 and Xbox 360. Download it now and have some cheats, all weapon, so much ammo you ever want."
Hidden Object - Lost Souls,Game,https://lh5.ggpht.com/EMLJs5ERNy_7jXYjbVpU4-seHbZAX5ID21eq_6ffxmQ8AdJo7oZ81fvHlNXyU0VO6Hw=w300,"10,000 - 50,000","November 4, 2013","They are still out there, restless... lost. And you are the only one who can help them with your gift of sight...Help the troubled ones accomplish their mission in the land of the living in this newest game brought to you by Difference Games, ""Souls of the Lost!""Guide the lost souls pass through the gate and rest eternally by finding hidden objects drifting in their memories of their past lives in 8 eerie, wrecked haunted houses in three different game modes and three difficulty levels.Be their light; let the Souls of the Lost find their way! But beware of malevolent spirits popping out of your screen!FEATURES-8 eerie stages to unlock!-3 difficulty modes: CASUAL, NORMAL, & CHALLENGE-3 game modes: PICTURE, SILHOUETTE, & WORDS"
Angry Truck Driver 3D,Game,https://lh4.ggpht.com/m_RPSglDE2Fd7N0L2g77qSc7A8S6VErFXJjkpi5ME9gIYKzir0fw0ev-RpX3MSm5bHI=w300,"50,000 - 100,000","October 26, 2013","Test your driving skills in new angry driving simulator. Angry Truck Driver is an ideal racing game for those who like truck driving simulator and truck parking games. Become a real truck driver who has to show his mastery. Driving game for kids and adults Angry Truck Driver will test your driving and parking skills.**HOW TO PLAY: Use gas and brake pedals to move. Drive accurate and finish the race of champions.  Improve your top truck and you will definitely win.**Angry Truck Driver action arcade features:- User-friendly interface and intuitive control.- Great opportunities for car improvement.Feel yourself like a Mr. driving master in new challenging transport game for free. Prove your attention, reaction and coordination with Angry Truck Driver."
Magic Wonders,Game,https://lh5.ggpht.com/TqNFPa-66M1zUQPfGpWVn2PyZeZd32gXM9eBWoeewrpmPKxW6kskLiWkupY_85WcJX4=w300,"10,000 - 50,000","October 17, 2013","Play this magic game to see which princess is most like youDress up your favorite Disney Princess! Pick her hair, dress, and more to help her have a magical day!Ariel is an independent and determined young mermaid. She spends her days singing, daydreaming, and adventuring with Sebastian and Flounder. She falls for a human named Eric and risks everything for her true love. Cinderella is kind to all, especially her mice friends, Jaq and Gus. She has faith that if you keep on believing, your wish will come true. With help from her fairy godmother, she gets a chance to live her dreams.Enter the world of magic and wonders of Walt Disney. Join the beautiful princess, and help her to complete this magic wonders.All Disney Princesses in this game, for cutest girls... Enjoy...Tags: princess games, disney game, mermaid games, dress up games, barbie games, girl games, free games, kids games"
1000 in 1 Games,Game,https://lh5.ggpht.com/R7-Rl8A-S4vGHXOFChUL-RAq0sIujDvt4n7jAwu1RYEdSe-xrvfiMtN5qMIKlOykv6aM=w300,"10,000 - 50,000","October 4, 2013"," If you have any objection please report to  Email:susannasynting@gmail.com This is a free collection of more than 1000 games. All game are free. You can download all-in-one pack. Our most famous games includes - Diner Dash Hometown Hero- Bloons Tower Defense 1 - 4- Snail Bob Grandpa Gift- A Real Surgery- Tower Bloxx- Twisted Cooking MaMa- Penguin Diner- Stick Figure Penalty Chamber 2- Crazy Real Haircuts- Western Shoot Championand more !!!New games and category every week.You can play the games online. If you like the game, you can download and to your device to play it offline"
Fashion Dress Up Game,Game,https://lh3.ggpht.com/iEa-jrkqPb4sqkwO-x1OT9HWC2GGVg6phPIpQgKJDdigOzC11PIsFOxX-0L9fmiNHw=w300,"100,000 - 500,000","November 4, 2013","♥ Express your sense of fashion and style by playing one of the most exciting 3D dress up games for girls today! Get ♥ Fashion Dress up Game ♥ for girls free and check if you can make a good fashion designer or a professional makeup artist! Hurry up, your girl model is waiting for you to turn her into a real fashion diva! Download one of the best dress up and makeup games for girls and discover thousands and thousands of unique dressing outfits for your fashion model! ♥♥ Dress up your girl in a stylish fancy manner!♥ Choose her skin color and type of makeup!♥ Choose from a number of fabulous hairstyles and different hair colors!♥ Combine different items of cloths to create a perfect outfit: dresses, tops, shirts, skirts, trousers, stockings, shoes in various colors, more than 100 models and more than 50 types of fabric!♥ Create more than 25 000 possible combinations!♥ Add accessories to round up her final look: sparkling jewelry, trendy purses and much more!♥ Customize, rotate, zoom in or zoom out the animated girl!♥ Pick the background you like most!♥ Take a photo of your masterpiece and don't forget to share it with your friends on Facebook and Twitter!♥ For all girls in love with fashion, makeup and hair styling, here comes a fantastic free dress up game that offers them the chance to express their creativity and sense of style and fashion. If you like playing celebrity dress up games for girls, try out this new 3D fashion game, turn your model into a star and make sure she outshines everybody on the runway. Download ♥ Fashion Dress Up Game 3D ♥, one of the most popular trending games for teenage girls and you'll never get enough of it. A totally free app for Android™ that offers instant fun! ♥♥ Fashion and makeover games are a great way to experiment with beauty and style, express imagination and creativity and try out different looks. Start playing this cool beauty game app for girls by choosing the perfect makeup for your super model and picking the hairstyle and hair color that suits her most. The endless variations and combinations of trendy clothes will make your mind boggle: trendy dresses, stylish tops, skirts, shirts or modern shoes. Combine these glamorous dress up items in various ways to get the perfect outfit for the catwalk. Add different accessories and give your model a fabulous look. Don't forget to share your creations with your friends. Show them you're a real fashion expert and a great personal stylist by playing one of the top new ""fashion games"" free! ♥♥ Makeover and hair games for girls are extremely popular these days, but not all of them can bring you equal fun and excitement. Awesome graphics, 3D animations, unlimited number of clothing combinations and many other interesting features make ♥Fashion Dress Up Game♥ one of the best “dress up games for girls” certainly worth downloading. Get this amazing beauty game app and enjoy dressing up your model any time. Be creative, let your imagination run wild and prove you can be a top stylist. Take pictures of the girls you dress up and show them to your friends. Don't forget to recommend ♥Fashion Dress Up Game 3D♥ to everybody because this free game simply has everything that popular games for girls should have: hairstyles, makeup and clothes. By downloading this free application you'll have the best combination of makeup games and fashion games and you'll never run out of clothing items and combinations. Don't waste your time, play our dress up games for girls and fill your free time with absolute fun and enjoyment. The super models are already waiting for you to dress them up for the fashion show!♥♥Add hair, nails and makeup and you'll have a whole beauty salon in your mobile device! With this cool new dress up game for Android the fun never dies! Get it now and see for yourself what makes it one of the best girls games on the market! ♥"
Contra Dynamic,Game,https://lh3.ggpht.com/eDAjRHj0fVqyNHEIUNuMZilgybxoUAZ_vtMBVPs8cMVfiwai4t1oiVn9xbgkbhwjYD8=w300,"50,000 - 100,000","October 28, 2013",Contra Dynamic Game
Dear Hunter 2014 Cheats Guide,Game,https://lh6.ggpht.com/kuX1J5obHvIxY3pqf3gLyeN2vJkNCIXnDjjKRC3St7BCTOnC9M84cQIaBWr1gfcKJw=w300,"10,000 - 50,000","October 11, 2013","Dear Hunter 2014 Cheats GuideHave you ever wanted to go further stage in Dear Hunter 2014?Now, you can see all of level solution in Dear Hunter 2014.This is the viewer of ""http://www.modojo.com/features/2013-09-19-deer-hunter-2014-cheats-and-tips"". This app publisher is not related to the creator of the site.Legal Notice:This app is an unofficial guide only, it is not authorized or created by the creator of the game. The game name, images, characters, logo and other details are not created by us but by their respective owners. If you feel there is a direct copyright or trademark violation that doesn't follow within the ""fair use"" guidelines, please contact us directly."
Moto Xtreme Race,Game,https://lh4.ggpht.com/bjz71qb007D7qpRupTCnGj35akGK163etdu-oEWnC2TT-X3KoAMW66PQ8xV7oKaK7g=w300,"100,000 - 500,000","October 15, 2013","Xtreme Motocross is an outstanding physics-based motocross game. Ride your bike throughout 180 amazing levels in the Coyote Desert, Snowflake Mountain, Big City, Autumn Forest, Spring Jungle and Moonwalk. Touch your screen to accelerate and break and tilt your device to keep you balanced while you enjoy the adrenaline of jumping off from cliffs and ramps. Try to reach the finish line in one piece, but if the worst happens, lean back and watch as your rider breaks most of his bones.- 180 amazing levels- 7 Worlds- Awesome graphics- Great Sounds and effects- Lots of Bikes to choose from"
8-bit Space Tower Defence TD,Game,https://lh6.ggpht.com/YQz44NF6MKXAE9ajaBQ8B9HTh4HJI_9EM84eomKnjsQEYeMgDc8abze3y7xyAP5mYBMF=w300,"50,000 - 100,000","November 3, 2013","Defend your planet against hordes of alien spaceships in this space old school futuristic fun action packed tower defense game with tactic elements! Armed with a advanced arsenal of turrets and unique upgrades, there is no end to the many strategies available at your disposal!* Free tower defense game in space stetting!* Perfectly works both on phones and tablets!* Great retro look!* Tons of ships!* Original 8-bit soundtrack!* Lots of turrets! Unique upgrades!* Challenging Levels! Old school!* Superweapons!* 2 game modes : campaign & survival!* Tons of achievements! * Constant updates! * Great support!* One of best free tower strategy war games!* Be true space hero! Have a lot of fun and challenge! Protect your planet from galaxy invaders!"
Mad Cop4: Police Race 4x4 3D,Game,https://lh5.ggpht.com/ocP3nbw8Y6Vg8AAJXcsP8EtNpwCIHQwEEFmaPaKoXpguQ0aAc4MPv8FBEri_09FG2rY=w300,"10,000 - 50,000","October 29, 2013","Step into the drivers seat and take control of your 4x4 Police Hummer.  Your Mission : Find the Mafia Bad guys and bring them to justice using any means possible. Mad Cop 4 sets the new standard in 4x4 racing games. It’s Hummer Time!  We bring you the next installment of the Mad Cop series with better graphics, improved game play, and optimized for the latest Google devices.MC4 puts you in control of the biggest, baddest police vehicle on the road : The 4x4 Hummer.  The game takes you through a series of driving skills test before you get the chance to go after the bad guys.REAL CARS We used ultra realistic 3D models in this game.  Hummers and other sports cars are used during the game.  Cops driving 4x4 chasing bad guys in Sports cars.  Does it get any more awesome than that?REALISTIC EXPLOSIONS AND OBSTACLESBoom goes the dynamite! We spared no expense to create the most realistic explosions possible. We use cones, ramps, barrels, and other barriers to keep the game as realistic as possible.REAL SCENERYRealistic looking 3D landscapes with trees, buildings, walls, and fences.  Yes, even the fences look real.  Simply amazing.REALISTIC MISSIONSComplete the mission to advance to the next level.  6 Different levels.  One Bonus level that is a free for all level.MULTIPLE VIEWSChoose to either be right behind the wheel, from the left or from the right.  This helps add a more realistic element to the game. What other players are saying about Mad Cop 4:“Looking forward to the latest installment of this fun game” -- Jarred from Michigan.“Loving my MC4.  Can’t wait until they add even more levels.” - Jim L. Columbus“YOLO! I mean, why can’t my girl get a star on the walk of fame? I love this game” -- K. WestHummer don’t play that!  Thanks for reading this far . . .now download the free game and give it a try!Mad Cop 4 : Hummer 4x4 Street Racing, Catch the Mafia before they catch you!"
Silly Ways To Live,Game,https://lh6.ggpht.com/bw1yYmfFNw0s8dqWxLDuYHtmImvPX-B_6EN16mzZTvaawsG_EEos2vWA_bHFtQ1ecKo=w300,"5,000 - 10,000","October 30, 2013","These 'Silly' characters are dumb in many ways, and they want to die. Why? Because they're dumb!Complete each level in just a few seconds using touch, drag, tilt, and other clever tricks. Work your way through all the challenges and compete to get the high score by using your brain. If the 'Silly' characters live, you will lose one of your lives. Each level gets quicker and quicker, so stay alert!  -------------------------------    This game is not affiliated with Dumb Ways to Die or Metro Trains. We have removed the train level from the game to comply with copyright requests.    -------------------------------   ""This dumb game Is to die for"" - Phillip Hoffman   ""One of the best ways to test my brain with puzzles"" - Jilby Rottenscheimmer   ""A great casual game for the bus, train, or plane ride"" - Louis Marshmallow"
B.O.B.'s Super Freaky Job,Game,https://lh4.ggpht.com/oLAHijNrPD277JMY8sdlFG3oKmkzW8g6cEevo_M5gtXDLP-9ylrcE53pbZS7zM3R_K4=w300,"10,000 - 50,000","October 23, 2013","Join Team Monster! Help B.O.B. on a gravity-defying quest around Area Fifty-Something by spinning and controlling the world around the indestructible gelatinous hero! Embark on classified missions under the command of General W. R. Monger to achieve WACKY and FREAKY MONSTER objectives and work your way up the ranks!But WATCH OUT for Coverton who's only goal is to FREEZE you and sabotage your mission! Remember, failure is not an option!!! Features:- Guide B.O.B through challenges by ROTATING the world around him! - Awesome obstacles like wormholes, lasers, ejectors, turbines and much more!- Freeze ray meter lets you know when you're in danger of icing over. - Assist Dr. Cockroach by recovering the spare parts he needs to build useful devices and machinery.- Earn stars and progress to other hilarious missions. Achieve perfection and you'll be awarded the prestigious Presidential Medal!- Fun sound effects and original music from the Monsters vs. Aliens movie"
Barbie Princess Dress Up,Game,https://lh3.ggpht.com/2wGHq9zzDeoKb-bXGt6lRg-URWVZRXMpk3ql0hHRixGKpe6E8-VzmS-n4OrUdj2_ByE=w300,"10,000 - 50,000","October 15, 2013","Believe each girl lives one princess like Barbie Princess in her heart. Do you know the secret behind her charming looks and why she are admired by many girls? Here you go! Barbie Princess Dress Up game is your dream game . You are so privileged as her personal stylist that you can unleash your unlimited imagination to give her a perfect makeover. Design a fabulous for your Barbie Princess face by making up with kinds of beauty products.Dress her up by choosing from varieties of beautiful outfits, Matching different fashion and precious jewelry which add glam for her look so that she becomes the most beautiful princess in the world.Features:☆ Make up: haristyles, lipsticks, blushs, eyeshadow,veye colors☆ Dress up: 10+ beautiful outfits and shoes☆ Accessories: Necklaces, earrings, crows☆ Different backgrounds☆ Show off your amazing art designs to your friends via Facebook or Twitter.☆ Save your beautiful Barbie Princess as wallpaper.Tags: Dress up, make up, makeover, fashion, chic, trendy, elegant, cute, beauty game, spa game, hair salon game, manicure nails game, pedicure game, girls game, barbie game, winx game, princess game, casual game."
Ultra Guide 4 Clash of Clans,Game,https://lh4.ggpht.com/WNxWGSeIRGypauwF0wv2vmXE68Wnjvx6iHz6O2xOkaVibukv9FC_oRACa7dDyaWhZA=w300,"10,000 - 50,000","October 23, 2013","Welcome to the Ultra Guide for Clash of ClansThe most up to date app for Clash of Clans for Android. INCLUDED:~ Super Strategy Guide - Best OFFENSE/DEFENSE Strategies for EVERY BATTLE! ~ Quick Start Guide for you N00bs to learn the ropes.~ Wiki - Every question you never asked has been answered! ~ News - What's happening in Clash of Clans, today???~ Level Walkthrough Videos - Quickly make your way through all the levels and score huge!~ Attack Strategies ~ Defensive StrategiesAND MUCH MORE !!!The greatest game on iOS (Clash of Clans!) is now available on Android! Step your Android game up now!We are not associated with Clash of Clans game (by SuperCell) Clash of Clans is a trademark of SuperCell.All other trademarks are property of their respective owners. These names are used for competitive comparison purposes only and do not constitute an endorsement or association of any kind."
Zombie Gunfire,Game,https://lh4.ggpht.com/SzJQt9z0HJS_LU8v2njkq_Ko_xBxzwxj362lAVLUsMm1op1uLVu1OZQWkb9s5fgPsboU=w300,"50,000 - 100,000","October 25, 2013","OUR BUILDING IS UNDER ZOMBIE ATTACK!Our headquarter in North American is under attack of chemical weapons,enemies also sent zombie troop there in order to take over the building.Those zombie soldiers pretend to be people working in that building and some of them carry guns with them.This is gonna be a battle we never met and it's no doubt the toughest one.Those zombies are not just saying,if you don't teach them a lesson,they would attack you and leave your corpse there and turn you into them!Let the gunfire and our snipers bullet talk,let this be a one way journey for those zombies. As one soldier of the troop,you have several missions to complete and you have weapons to choose from.Do this carefully and fight like a real soldier!"
