name,category,icon,downloads,updateDate,description
Perfect Parking,Game,https://lh5.ggpht.com/l9A8Qu2IMZbOUcdWuOc-0_mW4V_2DY90sd_PJ7sUEY3iXDyAv6DFeQ41Lq9Npg69vOs=w300,"100,000 - 500,000","October 9, 2013",Do you love driving? Do you have awesome motor skills?Perfect Parking is filled with challenging levels and epic cars to keep you entertained for hours!Over 20 LevelsAddictive Gameplay3D Environment Attractive GUIProgressive DifficultyReal Life CarsTested On:Samsung Galaxy S4Samsung Galaxy S3Samsung Galaxy S2Samsung Galaxy Note 8.0-Google Nexus 7-Wiko Roi-Vega CombSony Xperia arc STab-Galaxy 2
Triple Frenzy Slots - FREE,Game,https://lh5.ggpht.com/zhhuSJxbuZxCstiTWncMUTLd5KyMzB6tANPV-ubzV2cnQ9ZArHkn5dqfklwR7IEzT-E=w300,"1,000 - 5,000","October 23, 2013","Let's spin the wheel. Come On, Big Money !!Triple Frenzy Slot provides you the fun and excitement similar to a real casino slot. Awesome sound and graphic effects you will never feel from other casual slot games.- Triple Wheel Bonus - high pay wheel + multiplier wheel = BIG WIN- Different slot themes- Winning booster - Earn free coins- Level & experience bar- Wild Column will appear any time- Free Games with Wild Column - 1000+ Free coins every 4 hours- Ranking"
Nose Job - Surgery Games,Game,https://lh6.ggpht.com/8OM4BUK8yk8ZOi7qE1bnm3Ehlwq1TfmPzf5sQTmXdhZQFHH8CzRgqWGOdRCi_nqSZjWr=w300,"10,000 - 50,000","October 23, 2013","Rhinoplasty, commonly referred to as a ""nose job"", is a surgical procedure that is used to alter the length, shape, contour of the nose, modify the nostrils, or lift and define the tip of the nose. In our interactive rhinoplasty surgery, you will not only perform every step of the surgical procedure, but you will be able to also learn about the benefits and risks of rhinoplasty. So when you are ready, scrub in and become a cosmetic surgeon as you help remove an unwanted hump from a patient's nose!"
Critical SWAT strike,Game,https://lh6.ggpht.com/SlD8dqs-atKeeq_iC-sjCzA9MwVqhfVbmW6sC88eL_M3PeXJbUGu1BkCp_2hVi5O1uI=w300,"10,000 - 50,000","October 8, 2013","SWAT Critical strike is a free game of war. You are the elite army sniper and you have been called to defend the area. Terror has implemented and you have to eradicate! It is a war against terror. Use your smart phone to kill enemies in a 3D scene and explosions! There are more snipers, are the last of your team. Aim and shoot with your gun, fight relentlessly and compete with your friends. This is a game for fans of shooting games war!"
Despicable Me New Cheats,Game,https://lh4.ggpht.com/ugHKMILXgdUwr2NRLoUO_4U5pw3QmfWNmrHnNQ6eeiGaaQ-LcC8H-xhziHFMiZX1NhQ=w300,"50,000 - 100,000","October 23, 2013",Here are the best cheats for Despicable Me: Minion Rush. It supports the last version of the game. It's really working app. Enjoy the next features: - Unlimited bananas - Unlimited tokens  - All costumes are unlocked - All power-ups have max level - X2 time of the Mega Minion - X99 points multiplierGood Luck!Also you can find tips for Despicable Me: Minion Rush and high scores.
iSnipe:Z (Beta),Game,https://lh4.ggpht.com/sA_71reSkp7fOsDW-gC--Hw-NI-47rn3p2aG_-lwEYPnVd2i7vaPU0n7xsCc-_LwKg=w300,"10,000 - 50,000","October 21, 2013","===Notice== This is Beta ReleaseiSnipe:Z is an extension of ""Green Force: Zombies"" provides a unique experience of FPS Sniping games and Zombies shooter without compromising on the subtle aspects of individual genres.City is infected with deadly virus and people are turning into living dead causing mayhem. Government is trying to quarantine the infected areas, but failing completely. Those who survived the virus outbreak are at their own including the renowned professor Dr. Smith Kline. Who claims to have developed the drug to stop the outbreak and possibly cure the infected.The Zombies are forced to live at the expense of non-infected and nothing but the flesh! It's only a matter of time that there's no survivor.Green Force takes on the task to rescue the city and possibly save the world... with their Sniper Skills""The iSnipe:Z"" features:• Realistic gameplay mechanics of sniper genre games, adapted for a mobile platform.• Moving enemies and different bullet velocities give players a real challenge, with extra rewards for clean headshots and zombie killing sprees.• Your mission is to kill as many zombies as you can in each round and to prevent them from entering the safe zone.• Reach higher levels to encounter new types of zombies, and improve on your previous high scores!===========================================Like us and follow us on Facebook: http://www.facebook.com/raptorinteractiveYou can discuss your requests for the game on our facebook page.Suggestions and feedback always welcome."
Pharaoh's Escape,Game,https://lh5.ggpht.com/mFGCbAStS7veRx8h-SLnRWL2e3hv1ci-Sxij_OxKuL4LyR7uEpmvzvZkdJjQD6BcXo1p=w300,"10,000 - 50,000","October 11, 2013",You find yourself trapped in the endless tomb of ancient Pyramid. Test your puzzle solving skills and see if you can escape this mysterious place alive...Features:↗ Tricky puzzles↗ Logic brain teasers↗ Easy to start – impossible to put down↗ Explore tombs of ancient Egypt!↗ New rooms added frequently↗ Amazing graphics↗ 100% FREE for Android!How to play:Find items and manipulate objects to solve puzzles. Beat each level by opening the door and escaping the room.Game discussion:https://www.facebook.com/MobestMedia
Rambo lun - Metal Slug,Game,https://lh6.ggpht.com/KbWK0gYpc6QW72mizJKTQEbItecTQGGVR1wwXEIMFPz8oR_R6CAf99w87pJKT14hsFQ=w300,"10,000 - 50,000","October 21, 2013","[Game Free]Classic Game "" Metal Slug "" has been storming on the series Sega, PS,... landing Android.Game is kept original gameplay with map, sound, character, weapon,...What are you waiting. Let's go!"
Forest Mania: Match 3 Game,Game,https://lh4.ggpht.com/VNbTC3y5WdyNdqVJtaqcS8PggBhzUnYyPkAtcxz-bSnUaU0w_p--HNWgwUgySrdEOKo=w300,"1,000 - 5,000","October 31, 2013","★★★★ Download the BEST MATCH 3 game FOR FREE! ★★★★FOREST MANIA (FREE Match 3 Game) is the latest and newest in ACCUMULATIVE “Match 3” puzzles! Swap and match many cute and cuddly forest animals to gain points. Collect as many animals as possible before you run out of moves! You also need to find those 3-Matches with the most AWESOME chain reactions. Be lost in hours of FUN as you try to travel through the hundreds of levels and different themes that await you. Help the forest creatures as they get rid of Freddy Caveman from bullying animals and destroying the forests!Win levels and unlock more boosters to help you gain high scores!Forest Mania (FREE Match 3 Game) is totally FREE to play, with many in game items like ROLLING STONE, CLIP, and much more to help you. Starting items are plenty and have a shorter cool down time!  Best of all you can disable in-app purchases and NO annoying time limit!Hop into FOREST MANIA and protect the animals from Freddy Caveman’s bullying!★★★★ Exciting Features ★★★★● Match 3 cute and adorable creatures to complete level targets!● Match as much as you can before you run out of move!● Easy to learn, a lifetime to master!● 100+ well designed levels and WORLDY themes perfectly mix the simplicity and challenges for endless FUN!● Unlock different powerful items and boosters to help you get a HIGH SCORE!● Play normal mode to unlock more levels while defeat Freddy Caveman in Boss Mode!● The BEST match-3 game for all ages and genders!We are eager to hear any suggestions from you, please email to: zhaocai1985@gmail.com"
Age of Enigma,Game,https://lh4.ggpht.com/ejYZt99S1QK4-jQOAWULORXaTikgMyrYrT-QnC8zbADYVGxQ07c8glbDBPzDT6CfKv4=w300,"10,000 - 50,000","October 11, 2013","Help the ghostly inhabitants of a haunted house as you venture into the beyond and discover the secret of the 6th ghost! Mysteriously summoned to a house you have seen only in your nightmares, you will encounter the dark and inscrutable Nathan and help the ghosts held captive there in Age of Enigma: The Secret of the Sixth Ghost. Explore this spooky Adventure game and escape from hell! TRY IT FREE, THEN UNLOCK THE FULL ADVENTURE FROM WITHIN THE GAME! ☆☆☆☆☆ Features ☆☆☆☆☆ ✓ Colorful scenes come to life!✓ Follow a mesmerizing story✓ Solve unique puzzles to save each ghost! ☆☆☆ Discover more from Big Fish Games! ☆☆☆ Big Fish is the leading global marketplace to discover and enjoy casual games. You can enjoy our virtually endless selection of games anytime, anywhere — on your PC, Mac, mobile phone, or tablet. Learn more at bigfishgames.com!We have many other great Google Play games available.  Just type in 'Big Fish Games' for more fun and adventure! Follow us on Twitter: http://bigfi.sh/BigFishTwitterBecome a fan on Facebook: http://www.facebook.com/BigFishGamesMobile"
deer 2013 hunter,Game,https://lh4.ggpht.com/8G9xczQWjRriueiotNe-Ud6dQk5vIM4KHm-xIbdjjO_1uQ3qjxgIw7QS070xdF0iBqk=w300,"10,000 - 50,000","October 7, 2013","Welcome to Android deer 2013 hunter!There are five common methods of hunting. The first method is stand hunting. This is generally the most common method, depending on the terrain. This is done by waiting where deer are likely to travel. Stand hunting is commonly done in an elevated tree stand, but it can be done in a blind on the ground. Tree stands are usually placed 8 to 30 feet above the ground. The stands are made of metal or wood. Stands are often placed at the edge of fields of crops such as corn, wheat, buckwheat, alfalfa, clover, soybeans, cotton and many others. Often, hunters plant crops in strategic locations solely for the purpose of attracting deer. This is known as a food plot. Stands are also placed in the woods on the edge of trails that the deer travel on. Some states allow bait to be placed near these stands to attract the deer. This is different than planting a crop. The most common bait is corn.There are 3 Games!Game 1-Memory Game.  Unfold the block to match similar pictureGame 2-Puzzle Game.  Swift each block to the correct place!.Game 3-Block Game.  Change the block to fit each other.Once you have completed each levels, you will love this game very much.Tip on Scoring:---------------The more block you clear, the more score you will get.Other features:---------------You can pause the game and resume later.We have put the best collection of video of deer hunter 2014, cheats and walkthrough. Also include real deer hunting and funny videoDISCLAIMER: All names, trademarks and images are copyright of their respective owners. The use of any names, copyrights, trademarks or photos have been used for Descriptive Purpose only and not to show endorsement or permission of use. This is completely unofficial, and created for fans.This app is made by fans for fans, and it is for entertainment and personal use or purpose only."
Super Model Adult Strip Show,Game,https://lh6.ggpht.com/-zBk1LjzC-3d8bEnjkm1AcgX2DOlaDkSmURfgDjEj600_ISCaQwrc_ddIQNWZMHk=w300,"10,000 - 50,000","October 10, 2013","I feel every time when I go to filming. ""This chance is too good to miss!""Have you ever been to a real shooting that super adult model take off clothes?So I'm ready for you! Real model seduces you stripping clothes!Chilly autumn! Gonna meet the hottest adult actress!♡About Attracting Models♡★Model1 : Just street casted famous ordinary-looking girl★Model2 : Totally satisfying voyeuristic peek muscular girl★Model3 : Artists of Korea has a body want to touch   ※Pure and lovely girl of South Korea, Asia, best bagels of voluptuous glamor♡How to play♡-Three special undressed females will appear.-Win a One-Two-Three Battle and go to an real filming!-Two items make you never bet the game and you can continue game!★In public : Do Normal Play (2 wins for 3 times) ☞ Please play game hidden in secret because this is hot too.★In alone : Do Sexy Play (3 wins for 5 times) ☞ Don't worry about too sexy contents! Because you are adult!!! Just enjoy raunchy videos!♡Game Features♡☞Only Man game!   : 2013 Best HOT Sexy New Game! All men of the world can enjoy a mini-temptation-game!☞NO payment!   : Please stop pay! Free charging system is ready! Automatically notify you when there is no Orange points !☞Spartan Free Practice mode!    : Daily free 5 times of One-Two-Three practice and it is good to do lunch, coffee bet.    : Do not miss the free chance to practice every day!☞Real video game!    : This is not a game of cad battle style! This is 100% real video of unclad gravure pictorial filming!♡Notice♡☞If you have questions about game, please fill it out and send to the email address below.Email: chusongyi725@gmail.comInformation: phone number, handset model, questions☞This game is not available for younger than 19 years.☞When deleting an application, purchased items, contents does not recover. Please note this.☞Withdrawal and refund is not possible for purchased items and contents, except the fault of the application."
Moto Xtreme,Game,https://lh3.ggpht.com/KdpbiTp4Mp-BiGZmaloDvtojbp6pdcCLP1aTWiHBnQK4aErj6ebkNV3eTE2D4WyMvg=w300,"10,000 - 50,000","October 25, 2013","YOUR MOTO IS ROARING FOR A RACE!Are you a big fan of moto racing,and are you skilled at this? Have you ever dreamed of taking part in a moto racing championship and show your skills? Now comes the chance,the annual moto racing championship begins and all fans of moto racing could take part in this.This moto xtreme experience is the world's #1 side-scrolling moto racing game available on Android. The unparalleled physics engine gives you a level of control that you won¡¯t believe what you¡¯re playing in the palm of your hand!This is an exciting and totally free moto racing game! Drive your moto crossing all the obstacles as soon as possible.DON'T FALL DOWN TO THE GROUND!Launch off an enormous jump, land on your rear wheel and crash your way through a variety of well designed levels. Your reflexes will mean the difference between surviving or crashing in spectacular fashion.HOW TO PLAYLeft/Right arrow: let the man lean backward or forwardUp/Down arrow: let the moto move forward or backward"
Dead Defence,Game,https://lh6.ggpht.com/02FKYxrnMngq8X8UPTAiHz8Qd5StipjFtst8xWW0B9QiI_RWmh2RtyAQD2mVtS195Q=w300,"50,000 - 100,000","October 16, 2013","Only you can save humanity!Dead Defence - tower defense strategy, absorbing the best aspects of this genre!Use perfective weaponry, develop defensive installations and dont hesitate to deploy missile launches of incredible power!Few months ago virus of identified origin spread out the whole planet, infecting people and turning them into mindless flesh devourers. The attempt of scientists to neutralize this virus had escalated the infection outbreak. Now, the conclaves of remaining people are in danger of total extinction. It falls to you commander to save those people! Pay attention, Dead Defence absolutely free game; however you have opportunity to acquire some game content for real money.= GAME FEATURES = - ABSOLUTELY FREE GAME - Awesome realistic graphics, which conveys the atmosphere of postapocalyptic world- Vast weaponry arsenal- Combine the effects of your defensive towers- Protect the remains of humanity on every spot on the globe- Develop defensive turrets, improve their power and capacities- Bonus levels, which challenge the best hardcore playersRemember: You are the last hope!Have you faced any troubles or have suggestions? We would be glad to hear your comments and share our news and future plans for the game development on the following sources:http://www.facebook.com/DDefencepublic https://vk.com/ddefencegroup http://deaddefence.com"
Mind Blaster,Game,https://lh6.ggpht.com/pSXtbZNQL1S5FO_MSPuObQYCs4ajRPxvrqD2FG9-ylFEicC7GKaDyH4aAhBsDkDixYs=w300,"1,000 - 5,000","October 27, 2013","""Mind Blaster"" is an amazingly addictive mind game in which you train your brain by blasting matching objects.  In the ""Blast by Color"" mode, blast objects that are the same color by connecting 3 or more.In the ""Blast by Shape"" mode, blast objects that are the same shape by connecting 3 or more.Features:* Classic arcade shape blasting game.* Earn extra points by matching color and shape.* Disconnect and drop shapes off of the board for even more points!* Earn mPOINTs achievements for playing!Achievements you unlock will show up at the bottom of the screen during a game. Each achievementwill reward you with mPOINTS, which can be exchanged for coupons, raffle entries, prizes, and/or donations to a number of different charity organizations, so be sure to collect your well-earned mPOINTS!Happy Gaming!"
Zombie outbreak car parking 3D,Game,https://lh5.ggpht.com/w63pDsxlBxd4vGzQx78gGyG95kH2y5x9gyQCk79HEECfTaLH7f4ISUP5Lu452tqdQGLf=w300,"10,000 - 50,000","October 16, 2013","No warning, only quick news reports  to give the last survivors a quick warning. Stay in your house a zombie outbreak has hit the US said the warning. You survived the first signs and found more survivors and now  food is running out and you have volunteer to go on food runs. Since you are a great mechanic,  you have built an insane zombie apocalypse car to crush those zombies with.  The survivors count on you to collect food, collecting food is no problem, the way back to the safe house is the problem. The roads are invested with zombies, and now you need to clear the way with you insane zombie car. It almost looks like Halloween on the streets with all those monsters. Kill zombie with car! clear the zombie roadZombie outbreak car parking 3D is full of zombie monsters that will try to stop you from reaching the safe house where you can take a break. To survive this it’s important you park your car safely next to where the rest of the survivors hold up. This cool new 3D parking game has 20 parking missions you need to complete.This zombie parking game is designed to get you’re parking skills up in case of a zombie outbreak. There are a lot of different challenging parking situations in this 3D parking game full of zombie madness. Drive around in a 3D cool looking horror game setting and learn the ropes of controlling your car and smash your way through zombies. Drive your assume zombie smasher car by using the steering wheel in the right way and that is through the zombies. Use the throttle to hit them faster and brake before you hit a wall or something else. Sometimes the only way out is smashing trough the zombies backwards.In this Zombie outbreak car parking 3D game you can experience what it takes to be a zombie outbreak survivor  behind the wheel in a zombie smasher car. Have fun and enjoy this newest parking simulator game. Enjoy the different 3D levels and be smart in driving through these parking missions. 3D Parking game Features:-	Cool zombie smasher car to drive in-	20 extremely exciting  parking missions, be a hero and get trough safe-	Real life war parking situations, parking your car in the city is easy after this-	Realistic Controls, brake ,gas ,steering change your view and see from the inside what the best way is for every parking challenge we throw at you! -	Great dynamic gameplay, bumping your car against another and you’re done be careful in driving fast keep your need for speed under control-	Extreme precision driving simulator, small tight turns you need to get your best driving skills out to clear each mission!-	Park according the arrow, first take a look at the space and then work your parking magic!-	Tik, tok, tik, tok Every mission is a race against the clock, hurry up and park in time-	Zombies will try to stop you, so good luck out there  A great zombie outbreak has broken out, do you have your zombie apocalypse plan ready? Zombie outbreak car parking 3Dis about driving your car in a safe way to the zombie safe house.  Have fun and good luck to you. We hope you will enjoy this parking game and drive safely. Please give use some support by rating our game or by liking our Facebook page or follow us on twitter!.Facebook - https://www.facebook.com/VascoGames Twitter - https://twitter.com/VascoGames"
Slots Battle,Game,https://lh6.ggpht.com/bWwRC2M21rLbiw0UEJKGzPGFn1CAk3m3jUY9yvIonRLeFQSOkrWvsYXvbCI6zS_HHHY=w300,"1,000 - 5,000","October 7, 2013","Battle your way to the top of the leaderboard in this exciting, real-time slots competition!  Awesome trophies and credit prizes await those who can make it to the top tiers!  Boost your payouts with multiplier power-ups and bonus games.  Each tournament ends with awesome prizes and starts a new tournament directly after.  Tournaments are back to back, with a new machine for each one. Everyone plays to climb the current tourney going on. Here's just a few of the machines lined up:Salty Sailor MachineAhoy and set sail with the sea captain for salty rewards!Flippin Fruit MachineNinja slice your way through 12 fruits to the top of this machine!Bird Watchers MachineThis collection of birds will leave you tweeting with joy!On the Farm MachineAn exciting slot farm that would make old mcdonald jealous! Beautiful Beach MachineSun bathe in rewards and bonuses on the sun-kissed beach!Even more new slot machines will be released regularly!"
Rainy Barbie,Game,https://lh5.ggpht.com/1pWLd5u6zBckgXQ2xXBhkL2jJ63nAOaH9V2pekC_m1o5V9NKInsMmrzPwWa2MCLEr33H=w300,"10,000 - 50,000","October 8, 2013",It is raining outside. Barbie bored at home and wants to go out for a walk. She got her umbrella. Now dress up barbie for a rainy day.
Vinnie Shooter,Game,https://lh5.ggpht.com/WIwGDObF9J39urjgeQVh78uQQuI88pop5iKGJ2vPHB_rDhtsXSYSYMHN9w1G5Pzycfc=w300,"10,000 - 50,000","October 25, 2013","Vinnies Back! Shoot Vinnies would be attackers out the back window as they pull up to you.Try and get them before they kill you! Choose your weapon wisely, ready.. steady... FIRE! A great storyline and as always, excellent gameplay and graphics!A fun Vinnie game with Vinnie driving and you shooting!Keywords: Shooting Games, Gun Games, Guns Shoot Shooter Game"
Celebrity Pet Vet Doctor FREE,Game,https://lh6.ggpht.com/_3xE3OuJ-MhNNlZB4edzNZx7YXH36qqwMq4y2XeT-RDLTtZ8ffRUX7PrF36v9NRzW6U=w300,"5,000 - 10,000","October 23, 2013","Celebrity Pet Vet Doctor Free is here! Test your Veterinarian skills on famous, Hollywood animals! Help these pampered pets feel better! 1st CELEBRITY VET APP FOR PETS! These Beverly Hills pets need extra TLC! (Free Game!)Select your Celebrity Pet and become a Vet Doctor treating Fleas, Ticks, Rabies, Ear Infections, Rashes and more! Does your famous Dog get the ‘Cone of Shame’? Does your Grumpy Kitty have Flea Bites? Make your Celebrity Pets’ injuries go away and let them walk the Red Carpet again! Celebrity Pet Vet Doctor Free gets 5 paws! Celebrity Pet Vet Doctor FREE features:-	4 Adorable Pets- Boo dog, Uggie dog, Darwin monkey, Grumpy cat-	Pet Friendly Vet Tools-	Take your Celebrity Pet’s temperature-	Tons of Kooky Stickers -	Variety of Pet Ailments and Injuries. Get them Better Fast!-	Fleas, Ticks, Casts, the ‘Cone of Shame’ and more-	X-ray Machine, Eye Exam, Ear Exam, Rabies Shot and more-	Funny Animal Sounds-	Save to Gallery"
Dragon Simulator,Game,https://lh6.ggpht.com/giKs1cdC0tFvmWfNDpzSMeW7BL4W2RIuoBO0isbQJS0TFEzOAk43B4dhpt3a5s6jgA=w300,"10,000 - 50,000","November 4, 2013","Dragon Simulator –  dragon rush speed games, exciting flight simulator 3DDo you love dragon slayer reaction games or dream about a real dragon pet? Get a magic fantasy dragon vale world in your mobile device. More dragon fly free story arcades - more fun! Dragon Simulator 3D is an unbelievable flying run and jump experience in a dragon land. Tap tap revenge for brave dragon hunters.Control the flight of the gorgeous fire dragon. Save him from crashes and spit fire to scare everyone around. Dragon monster saga is back! Welcome to the tap dragon park filled with unexpected adventures. Dragons of Atlantis take part in addictive racing action.Dragon Simulator features:- Gyroscope game, tilt the Smartphone to fly over the hills- Amazing nature views- Exstreme fly with realistic physics effects- Flying racing games for kids and adultsAnimal game free. Fly like a wind in steeple-chase tournament Dragon Simulator!"
Combat Monsters,Game,https://lh4.ggpht.com/UjWFAOlUqPGur_M_XcJCPIZDPMaEa2h5psp6fUO2OYCc9JRiL01sBlOXcVlw-gTv7ps=w300,"10,000 - 50,000","November 5, 2013","Combat Monsters are not your everyday monsters. They will follow your commands to vanquish the enemy… or die a fiery death! Play for FREE against friends right in front of you or on the other side of the globe or enjoy the large single-player campaigns.Devise strategies that make the most of your deck: will you overrun your adversary with dozens of bloodthirsty creatures? Defend your Hero at all costs with healing spells? Invest heavily in runes and concentrate on a few high-powered cards? With 132 monsters, 70 weapons, 28 shields, 42 spells, 22 runes, 12 Heroes and 120+ maps to choose from, there’s no end to the challenge in Combat Monsters.After completing the campaign, it’s time to join the carnage online with up to SIX PLAYERS on a single board or two player pass & play. No friends? No problem! We included a Quick Battle skirmish mode that will get you a game in no time at all.Combat Monsters is a unique combination of collectable card game and tactical combat, 9 man-years in the making. If you’re a fan of CCGs and/or turn-based strategy games, we made this game for you. Can you beat all the achievements? Will you be the one to acquire the first legendary card? Download Combat Monsters today – and find out!"
