name,category,icon,downloads,updateDate,description
Doctor X: Zombie’s Surgeon,Game,https://lh3.ggpht.com/YT6GlaqWRZ2z1-89i66zT-jLkEKsZb9TtWBGqsbeLa_ixhg0MCltQ0bekuL2tdJxZNw=w300,"100,000 - 500,000","October 10, 2013","“BRAAAINS!” It’s Halloween and there’s a waiting room full of spooky zombies! Curing Zombies this Halloween? Use special doctor tools like the pliers or stapler! Zombies (not just trick or treaters!) are patients too! They require special medical attention!This city was infested with Zombies a long time ago, but now the situation is under control thanks to the heroes you saved before! Now though, until we find a cure for the zombie virus, we need you to take care of the zombies around town! Sure they might have tried to eat trick-or-treaters once or twice, but hey, they were zombies-- it’s not their fault! Our scientists are working on a cure, so in the meantime, we need you to stitch them up, find and remove the nails, worms and all the bits and pieces of things! So, Dr. X, I’m sure you have all your awesome tools from before and some new ones too in those bags of yours! Now let’s get to work and treat some zombies! (They might try to bite though, doc, so be careful!) Features: > Diagnose your Zombie patients with some cool tools like the stethoscope, thermometer, x-ray, and electrocardiogram! > Take out the nails and wacky stuff lodged in their bodies, to make sure they’re fixed up! > Don’t forget to sew the holes shut too doctor! We don’t want what’s inside to spill out too much! Use the Stapler too! > We even created a special acid compound that can burn off the infection without hurting them! Try it out, but be careful! What’s inside (the zombie-- I mean, the game): > 2 awesome doctor kits! > 4 diagnosing tools like the thermometer or the x-ray machine! > 9 treatment tools like the casts, syringes, and glue too! (Yes, Doc, we do with what we’ve got!)> 8 colorful brushes to apply the medicine with! WE VALUE YOUR FEEDBACKParents and kids are our best reviewers. If you have a moment, feel free to rate and review our app. We'd also love to get your feedback to our email: support@TabTale.comABOUT TabTaleSearch “TabTale” on Google Play and discover more incredible apps for young kids. TabTale’s smart games provide an exciting, interactive, and rich educational experience. Filled with innovative and engaging activities, each application inspires creativity and imagination in a way that is uniquely enjoyable and stimulating. Let the games begin! More games are coming soon....Join our Facebook Page: www.facebook.com/TabTaleFollow us on Twitter: @TabTaleIf you're having problems with downloads, installs, refunds, payments, or Google Play access, please contact Google Play team through the Google Play Help Center at https://market.android.com/support/ and user forum at http://www.google.com/support/forum/p/Android+Market.By downloading this application you agree to the Terms of Use of TabTale Ltd. which are available to your review on http://tabtale.com/terms-of-use.NEED HELP?Contact us 24/7 with any questions or comments: support@TabTale.com"
Championship Jet Ski FREE,Game,https://lh6.ggpht.com/pK6e-tCNGtVGPQyX3AaIpLfj5Ko5dchJ487iCG5ISraNutPsjxPz75BIAMTPcWId6hYM=w300,"500,000 - 1,000,000","October 29, 2013","Grab your sunglasses! This time our  Championship series takes you to the sunny beaches,  luxury marinas and  lakes of the Jet ski circuit . Choose from our powerful range of super fast jet skis and be crowned ruler of the WavesCompete with AI or your friends in 3 beautiful locations:    Monaco, Australia and California. 4 game modes: Single Race, Championship, Time Attack and Local Multiplayer will test your skills and deliver tons of fun.Key Features:- 3 beautiful and challenging locations: Monaco, Australia, California;- 12 tracks;- 4 game modes: Single Race, Championships, Time Attack, Local Multiplayer;- Real Jet Ski experience;- High quality graphics and sounds;- Realistic driving model;This game is ad-supported."
Jurassic Story - Fun Games,Game,https://lh4.ggpht.com/Z77SxpDcdzMYdkx8Zqd9s36rUNmtjGg-peq6gRNSEItS0v7ioLYHg7CMsbNHx7tTLKw=w300,"50,000 - 100,000","October 31, 2013","LIMITED TIME OFFER!!! Get super Bonus items! Jurassic Story is a totally fun new entertaining social dinosaur game that is sure to keep you entertained. Build and Reproduce your own dinosaur world. Tiny dragon looking dinosaurs move around as if they were your pets. Get back to ancient periods when the dinosaurs lived long long time ago. Experience and learn how and where the dinosaur lived.*Halloween Event in session!!Get Awesome Halloween dinosaurs!!*Tablet device compatibleGAMES FEATURES - Tons of adorable dinosaurs to raise. - Feed and care for cute and tiny kids dinosaurs until they evolve.- Breed hybrid dinosaurs.- Unique breeding system(breed dinosaurs using hints) - Explore and find rare eggs like strategy games. - Eye-popping animations with beautiful sounds. - Design and Complete 3 different maps including Triassic,Jurassic,Cretaceous period - Supports Facebook to visit and trade gifts with friends- Food house for the dinosaurs like boys and girls to feed- Complete all the missions and achieve great prizes - Lucky bonus with fun fantastic animation. - Fun for All ages including boys and girls and kids.Most of the dinosaurs information is true or at least said to be true. Good learning tools for kids to become a dinosaur master. There are many cute dinosaur and dragon games apps in GooglePlay but our tiny dragon and monster is the best!!Having problems? Any suggestions? We would love to hear from you! You can reach us at Facebook page.- Facebook Pagehttps://www.facebook.com/JurassicStoryWe love games so please give us suggestions!!"
Bubble Mania,Game,https://lh3.ggpht.com/3WA1WEYiw2Cbt98zbbQeCDIS_k5wQ85TlCF7qKLLqUvWacijHsC9-4PiVPKFWsDI1X9h=w300,"500,000 - 1,000,000","October 16, 2013","Bubble Mania is a brand new puzzle game!Same colored bubbles would link together, Special bubbles link together produce chain reaction! Innovative gameplay, take your completely new gaming experience.Challenge the high score in all stages! Have fun!Play with your friends:- Sign in with Google+ to play with your friends!- Compare your scores with friends using social leaderboards.How to play:- Move same colored bubbles to link together.- Special bubbles link together produce chain reaction!  - Boost your scores with game props.Features:- Easy to learn but hard to game master.- Fast-paced game and get more fun.- Three stages and many challenging levels.- Various interesting props you should learn from game.Rate this game now! Any suggestion is welcome!"
Neon Sniper,Game,https://lh6.ggpht.com/RhUxtxJyvN8rPNdu0FAdqQb3wtcbK0rS0oFIMHD6oMEAiRwXhlEcSUWtgZrwO1KMQ8PD=w300,"100,000 - 500,000","October 8, 2013","Aim and shoot! Kill all the terrorists in this NEON THEMED shooting game.Features:★ Beautiful 3D graphics★ Easy controls★ Over 30 levels★ Many different weapons including Sniper rifles, pistols, and other guns★ Intelligent Enemies with advanced AITest your sniping skills in this free and fun Sniper game.If you love classic shooting games like Counter Strike and Call of Duty, you will love NEON SNIPER: Counter Terrorism!"
Bubble Shooter Violet,Game,https://lh5.ggpht.com/wsmGpj_pFXqMnhh1du2Zs4ZFtucxs1d6dDoceP_-kBOi0MxmcjHFWVULgPXVAq7r2A4=w300,"500,000 - 1,000,000","October 18, 2013","Fun and addictive bubble shoot game!Another classic bubble shooter gameClear all the bubbles on the screen to level up.How to play:1.Tap where you want the ball.2.Group 3 or more bubbles to make them burst.Features:- Arcade Mode,clear all the descending bubbles.- Puzzle Mode,use the limited bubbles to clear all the bubbles on the screen.- Countdown mode, you can switch bubbles that you shoot with different colors.- 260 different and challenging levels."
Deal or No Deal Free,Game,https://lh6.ggpht.com/Ga4KG0ZBD0wBCp7LnkkZKOVaiB04beTHxbR8PFONgSUK3NrDZX7k9QaqiOJGql3kNCQ=w300,"50,000 - 100,000","October 8, 2013","Play our Deal or No Deal game and beat the odds - and the bank. There is no real money involved, so have fun and see how far you can push your luck! Each suitcase contains a sum of money. The amounts in the suitcases are listed at the side of the game screen. As you open each suitcase, it disappears and its amount is shaded in on the side lists. First choose one numbered suitcase from the 26 on offer. This becomes 'your' suitcase and it is moved, unopened, to the bottom left-hand corner of the game screen. In each round of the Deal or No Deal game you must select more suitcases; six in round one, five in round two, etc. The suitcases are opened as you click on them and the amount in each suitcase is shaded in on the lists at the side. These amounts are now out of play and cannot be won. At the end of each round, the Banker makes you an offer based on the amounts of money that may still be won. You decide whether to accept the offer or not - Deal or No Deal! If you decline the Banker's offer at the end of each round, the game continues with you choosing more suitcases to view. When only two suitcases remain, one in the main board and 'your' suitcase up in bottom-left corner, you open 'your' suitcase and find out if you managed to beat the bank. If you accept the Banker's offer at the end of any round, you may continue to play to the end and find out if you were wise to accept when you did, if the amount in 'your' suitcase was higher or lower than the bank's offer or whether the Banker may have made a more generous offer later on."
Mega Rush,Game,https://lh6.ggpht.com/q5LMw6_Q2XTZhVcEmA0whGrMkkUdst0UEPy3jPGKlISSXCATep_iwfho5KJef5J1A99d=w300,"1,000,000 - 5,000,000","October 23, 2013","With crisp touch controls, completely unpredictable competitors, and an incredible sense of speed, Mega Rush is #1 irresistible fast-paced running game for Android phones and tablets.Play as a little boy or girl and compete with other players in hilarious, fast-paced challenges in order to win the race. Dash, jump, dodge obstacles, collect and activate power-ups, be mischievous, and defeat others across stunning fair-tale environments.How to Play:- Touch bottom right to Jump (touch again to jump higher)- Touch bottom left to activate special power-upsGame Features:- Simple touch controls that are easy to use- Colorful and vivid HD graphics- Collect ingenious power-ups to help you run faster"
Little Commander WW2 Halloween,Game,https://lh3.ggpht.com/2Pchpz4XvD8XbEGmo6FcxSEnaqi63CisaizUiEK7sRMmdJJKZw3qEYhq2N_rLtfXWNbl=w300,"500,000 - 1,000,000","November 3, 2013","This is the Halloween special version of 'Little Commander - WW II TD'.Are you tired of hard core defense games? Then, try this one!This is an easy-to-play tower defense game in a very cute cartoon style.War has entered the intensified stage: the city has been surrounded by tanks; the guards have lost contact with the main force. At this critical moment, how should you rescue your companions as a little commander? Take your heart and you may change the war!In this game, you shall act as a little commander, who has taken control of a small troop temporarily. Your goal is to fight against the waves of enemies’ attacks! While fighting against your enemies, you should to improve your strategy and become a better commander! There are 6 different types of upgradable turrets available in the game; you should arrange them wisely on the enemies’ pathway to block them.FEATURES:- Strong atmosphere of World War II, the cartoon-style graphic design and the excellent sound effect.- Real weapons in World War II are available in cartoon style: [Bazooka / 155mm Cannon / B-29 Bomber / Panzer VI Ausf. E Tiger / Zeppelin Airship].- Easy to operate: drag and drop to build units; pinch to zoom in/out.- 75 well designed levels, and more are coming soon.- 3 different game modes (Normal, Endless, Single Life)- 6 different types of upgradable turrets.- 10 types of well designed enemy units.- Special Weapons: call bombers to destroy all enemies by carpet bombing- 3 different eye-catching theme terrains.- Facility for newbie: enjoy the 'free and easy' casual mode! - Famous battles in WW II are available, including Normandy landings, Battle of Stalingrad, Poland blitzkrieg, Battle of Moscow, Operation Barbarossa, Battle of Berlin and many more.- Record 30 famous battles int WW II, which contains Normandy landings, Battle of Stalingrad, Poland blitzkrieg, Battle of Moscow, Operation Barbarossa, Battle of Berlin and many more. ------------------------------Try other awesome games by Cat Studio------------------------------""Egypt Legend - Temple of Anubis"" - A Zuma style game with egypt theme.""Little Commander - World War II TD"" - A TD game with very cute visual style.""Soldiers of Glory : World War 2"" - Act as the Allied commander and win the WWII!""Soldiers of Glory : Modern War"" - A TD game that enemies could attack you back!""Epic Defense - the Elements"" - A TD game with war3 visual style.""Epic Defense 2 - Wind Spells"" - the second work of Epic Defense series, more new elements! more new towers!""Galaxy Wars Defense"" - A Space Sci-Fi TD with Stunning Graphics and Super Big Maps!""Zerg Must Die"" - A TD game with SC2 style. The gameplay very like Defense Grid""Marble Blast - Zodiac"" - Another very good Zuma Game, and you can draw your custom levels!""Global Defense: Zombie War"" - Do you like killing zombies? Fans of World War Z will like this defense game! ------------------------------Cat Studio's Facebook Page: https://www.facebook.com/CatStudioGamesCat Studio's Tiwtter: https://twitter.com/CatStudio_GamesCat Studio's Youtube Channel: https://youtube.com/CatStudioGames------------------------------Facebook Page of Little Commander - WW II TD: https://www.facebook.com/LittleCommanderWW2"
Baby Playdate,Game,https://lh3.ggpht.com/JbYgxeXJKbWAwdjn73FqVnUb9S8a_VPQkQimH-M7x5x3tCrRUvdzTZiPE9gr57ZNpnA=w300,"100,000 - 500,000","October 9, 2013","Baby Hazel and Baby Jake are friends. They enjoy playing together. Today, Baby Hazel is going to Baby Jakes house for a play date. Their moms too, want to relax together while their kids enjoy playing. Help Baby Hazel and her friend Baby Jake, by fulfilling their needs while they play together. Try your best when you will play Baby Hazel Playdate. If you don't like Girl games, we have several other free games for you."
Jam City,Game,https://lh5.ggpht.com/c3kAecZDZWy6Thn5OzKBer_8d0iUFlR6YmuZWLy1a_wj-BbGr-Y_DarFAMuRwI-Clyc=w300,"10,000 - 50,000","November 2, 2013","Grab a basketball and slam-dunk like never before!ARCADE-STYLE, HOTSPOTS, AND MORE!Play everything from traditional Team Matches to more personal Hotspot games. Better yet, play in Practice Mode to goof around and get better!- Team Matches- Hotspots with leader-boards to compete against friends!LOADS OF CONTENT TO MIX AND MATCHChoose your team and modify their skills to fit your play style!- 10 Dunks to collect and show-off- 12 Teams with unique abilities- 22 Shoes to enhance speed, dunking, and stealing skills- 18 Balls to enhance shootingUPCOMING FEATURESHelp us decide which features to add next.  Would you like a tournament mode?  How about more new courts?  Leave it below in the comments!"
Birzzle,Game,https://lh5.ggpht.com/Gti-r8u4PJDIiNR0UQ3wY7XB8IYz3CnfxMp4dRYLgC5dgt3SL-ZRT_f_Be9GRxxCUk98=w300,"50,000 - 100,000","November 4, 2013","Pandora Mode is coming!!!★★★★★ 7 millions Downloads in Google Play!! ★★★★★ Korean Mobile App Award 2011 ★★★★★ The most popular application (1st place) in Asia appstore - Distimo, TechCrunch Description A brand new drag and drop block puzzle game; line up the same cute birds and make them disappear! New mechanics provide better flexibility and touch controls than other puzzle games giving you a quick action arcade puzzle anyone can enjoy. The birds move freely, and the faster you move your fingers the better your score!1. Classic Mode : A speedy free action puzzle game. 2. Pandora Mode : The goal of Pandora mode is to match birds and collect the letters in order to get the highest score possible in two minutes. 3. Ice Break Mode : Tense and thrilling mode within a set time while breaking the ice. ※ Game specific features 1. A game people of all ages can enjoy. 2. Touch-screen optimized control 3. Offer 3 different game modes 4. Play with your Facebook friends all over the world. ※ Follow and join us! Website : http://birzzle.com Facebook : http://www.facebook.com/BirzzleOfficial Twitter : http://www.twitter.com/enfeelstudio Contact : cs@enfeel.com9. WebSiteWebSite : http://www.enfeel.comemail : cs@enfeel.com"
Celebrity Face Mania,Game,https://lh3.ggpht.com/vkoyhNzdaQX3AJUarbdfxPa4HDRHLJdq47Al3Bo3-H9fyRUNvovm8a6i8aTxnjNB8aVs=w300,"50,000 - 100,000","October 23, 2013","Get the game everyone is talking about now FREE!!How well do you know your favorite celebrity's face?It looks like Justin Bieber's head...but that's not his eyes, nose or mouth! Can you swipe each layer to find the parts that fit?!What would Rihanna look like with Miley Cyrus's eyes? Or your face mashed up with your cat's?!Find out all this and more in Face Mania!!Don´t forget to follow us on our social networks! https://www.facebook.com/facemania★ PURE, INSTANT FUN ★Free, No Registration required. Super easy to get started.★ CAN YOU GUESS THEM ALL? ★World’s most famous faces are here now! Can you guess them all? Let us know who you would like added?!★ PLAY WITH FRIENDS ★Mix your own face with a famous face! Then share with your friends on Facebook!Following celebrities included :  - Justin Bieber  - Mila Kunis  - Nicki Minaj  - Niall Horan  - Louis Tomlinson  - Zayn Malik  - Harry Styles  - Liam Payne  - Beyonce  - Alicia Keys  - Britney Spears  - Lady Gaga  - Katy Perry  - Selena Gomez  - Justin Timberlake  - Ne-Yo  - Jay-Z  - Kanye West  - Eminem  - Miley Cyrus  - Kim Kardashian  - Pharrell  - Taylor Lautner  - Robert Pattinson  - Rihanna  - Johnny Depp  - Zac Efron  - Taylor Swift  - One Direction  - Kristen Stewart  - Angelina Jolie  - Megan Fox  - Jessica Alba  - Jennifer Lawrence  - Scarlett Johansson  - Emma Watson   - many, many more!!"
Hidden Object - House Secrets,Game,https://lh4.ggpht.com/b7QQo2egiUHYXJ7a34zpbGFRIIBZT0XH3Mk6PUvcwnY-TjrGtL6zQns9FHf9ed9xvow=w300,"50,000 - 100,000","November 3, 2013","Every house has its secrets - some of them in broad daylight, some are hidden somewhat better. In the shadows.This wonderful hidden object game gives you the unique opportunity to find amazing life-like items in different rooms of a suburban house.Enjoy the full game for FREE!   *There is another version you can buy for $.99 if you would like to play without any ads.  Everything is the same except the ads are removed.What we give you, are three difficulty levels:- CASUAL - No time limit and quick hint. All modes available for each unlocked level!- NORMAL - Time limit and slower hint. Each use of hint costs 2 seconds. Only those modes you've played in the previous level are available in the next one.- EXPERT - Bonus mode for those who got all stars on all levels in either CASUAL or NORMAL mode. Each scene can be completed in three search modes:- By PICTURE- By WORD- By SILHOUETTEComplete each of them on the scene to get three stars! Go back to previous levels to get a better score and unlock the next section! Features: - clever fun to solve hidden object scenes- item search by word or by pictures and by silhouette- inspiring artwork in realistic locations- difficulty levels and unlockable content"
Speed Racing Ultimate Free,Game,https://lh4.ggpht.com/O4Zaj7azygs2HFm_qBS76dke9g33J71JNk1xWJtdT51YuS1ul0GK0-4tcd835bTKQg4=w300,"100,000 - 500,000","October 21, 2013","""Speed Racing Ultimate"" is the only game that offers Incredible speed and steering sensations!Pilot 8 different Prestigious cars on not less than 10 tracks around the world!Challenge the best drivers and try to win to increase your money!A ""Shop"" is available on the main menu.If you have enough money, you could get more powerful Car!Fasten your seatbelt and take the control of your eXtremely Powerful Car!You have mastered acceleration, braking and steering!Don't forget that the Drift is your friend!Attention! The speed will be your ally, only if you master!The tracks are more and more  technical and require an optimal concentration!I suggest you to start with the initiation track to learn to control your Powerful Car.It's available on the main menu by clicking on the ""Help"" button.After that, try to get the Gold Cup of the ULTIMATE track!You can select the level of difficulty: Beginner, Expert or Pilot.Your choice is very important:If you choose ""Pilot"", all races will be more difficult but you will win more money!If your are in the top 3, you will win a special Bonus!You also can choose the ""Fight"" Level and Try to be the Best!In this level, there is no Limit.Only one rule: IT MUST REMAIN ONE!Are you ready to challenge the best drivers of Real Racing Game?The time of each race is recorded.Share your score online and try to stay in the world ranking!So you can compete with players around the World!You can see the rankings at any time by clicking on the logo ""World High Scores"".Incredible speed and steering sensations await you!Have Fun!••• Game Features •••• Drive 8 different Prestigious cars!• Total Control of your Racing Car• Full 3D Real Time rendering• 10 different tracks• Incredible arcade physics• Spectacular SFX• Save as much money and Power go up• Customize your Racing Car• Training mode• Realistic sound environment• Music by ""REVENGE""• Boost Bonus• Select the difficulty level• Select the accelerometer sensibility• Select the Camera: Inside or Outside• Upload your Score and enter in the World Ranking"
Just Shout,Game,https://lh4.ggpht.com/dpY8CWAujYxtJd2rsqNR36I0fnlhjaBRd3iE6DmbyqKi6UP0YR1pT4bu8DMPo8ucT1A=w300,"100,000 - 500,000","October 28, 2013","Just Shout is a survival, mob-fighting game. John Shout is a vicious American bulldog fighter whose wife was killed by the local Mob – The Grizzlies. Now, John is seeking revenge. Help John Shout kill all the mobsters in this comic-style, action game.Choose among lots of weapons, ranging from the classic guerrilla knife, to devastating, high-tech flame-throwers. Keep John alive and kill as many mobsters as you can!   Features:– Infinite number of enemies.– Lots of weapons to unlock.– 30 levels of increasing difficulty.– 4 powerful air-strikes.– In-game supplies store.– User friendly interface.– High quality sounds & graphics."
Bus Parking Simulator 3D,Game,https://lh4.ggpht.com/eI4em26Nglr_ve9-SYl8tVRxiUnCc83D7BXrfT3KWwUlQQVwYzxibfp7mNhvYqu0yjwv=w300,"100,000 - 500,000","October 11, 2013","Do you want to try out driving big vehicles, including buses? Check out this simulation game now!Bus Parking recreates the experience of parking a real bus. This title joins Tapinator's three prior parking titles - Truck Parking, Limousine Parking, and Trucker Parking. Bus Parking is the latest addition in the best line of parking simulator games in the app store. The game features realistic physics, smooth controls and challenging gameplay. Try to be the best bus driver on the planet with our online ranking features and achievements. Bus Parking Simulator 3D is the ultimate parking, driving, and bus simulator!In this parking game, you can choose between 2 detailed environments, over 50 parking lot levels and unlimited entertainment. Do you think you can park the school bus on a TRIP TO THE MUSEUM and when it's BACK TO SCHOOL time? Challenge yourself by trying to be as fast as you can without crashing!★★★ BUS PARKING SIMULATOR 3D FEATURES★★★✔ Lots of cool school buses✔ 2 challenging environments ✔ Ability to a skip level, if desired✔ Ability to use 2 touch steering options or the built-in Accelerometer✔ 4 Different Camera Angles to achieve maximum visibilityThe game uses superior graphics tailored to high end devices, including the Samsung Galaxy S4, and Nexus.If you enjoy our app, don’t forget to show us some love by leaving a positive review!__________Tags : Bus, Parking, Simulator , 3D , Fantasy, Hidden , Driving,  Car, Monster, Vehicles"
Jewel Mania,Game,https://lh5.ggpht.com/1ZiEO8Lt5-1__hb3dJ7ZRXu_RDmpMpRN2Q2_8laTiBe4eXTpuWeXu4RnyGIb0yvZOtE=w300,"50,000 - 100,000","October 8, 2013","Jewels Mania is a classic jewels-matching game with many new exciting features, awesome visual effects and special power-ups. Once you start, you can't stop!By playing this game you may find yourself hopelessly addicted to swapping the glorious jewels. It is a simple but extremely fun match-3 game.How to Play:- Match 3 identical jewels to eliminate them- Match more jewels for multiple pointsFEATURES:- Three Game Modes: Normal, Time, Quick- Easy-to-play interface with save function- Global, cross-platform leaderboards (Scoreloop) -- compete with players around the world!- Nice, clean graphics and smooth game playWhat are you waiting for? Download JEWELS Mania now!"
